{
  "schema_version": 1,
  "id": "TASK-001",
  "project_profile": "fixture",
  "title": "Find why average() returns the wrong value",
  "goal": "Problem: average([2,4,6]) should return 4 but returns a different value. Goal: find the root cause of the wrong average() value and fix it.",
  "phase": "DONE",
  "paused_from": null,
  "mode": "deep",
  "repo": {
    "root": ".",
    "branch": "master",
    "base_commit": "a6558709a38078de799273851ae162d4d9a0599e"
  },
  "success_criteria": [
    "Root cause identified with path:line evidence",
    "npm test passes after the fix"
  ],
  "constraints": [
    "Read-only until the plan is approved",
    "Keep the average() signature unchanged"
  ],
  "artifacts": [
    "exploration.md",
    "system-map.md",
    "questions.md",
    "plan.md",
    "validation.md",
    "decisions.md",
    "handoff.md"
  ],
  "findings": [
    {
      "id": "F-001",
      "claim": "sum() starts its loop at index 1, so it skips numbers[0]; this is the root cause (sum([2,4,6]) returns 10, not 12).",
      "evidence": [
        {
          "path": "src/sum.js",
          "line_start": 6,
          "line_end": 12,
          "note": "for (let i = 1; ...) skips the first element"
        }
      ],
      "confidence": "high",
      "open_questions": [],
      "last_verified_commit": "a6558709a38078de799273851ae162d4d9a0599e",
      "source": "ewm:repo-scout",
      "stale": false,
      "recorded_at": "2026-10-09T23:30:25.955Z"
    },
    {
      "id": "F-002",
      "claim": "average() returns 0 for an empty list and otherwise computes sum(numbers) / numbers.length, so it inherits sum()'s error: average([2,4,6]) evaluates to 10/3 (about 3.33) instead of 4.",
      "evidence": [
        {
          "path": "src/average.js",
          "line_start": 7,
          "line_end": 12,
          "note": "delegates addition to sum"
        },
        {
          "path": "src/sum.js",
          "line_start": 8,
          "line_end": 10
        }
      ],
      "confidence": "high",
      "open_questions": [],
      "last_verified_commit": "a6558709a38078de799273851ae162d4d9a0599e",
      "source": "ewm:repo-scout",
      "stale": false,
      "recorded_at": "2026-10-09T23:30:27.317Z"
    },
    {
      "id": "F-003",
      "claim": "The design note requires sum(xs) to add every element including the first, and average(xs) * xs.length to equal sum(xs); the current sum violates both.",
      "evidence": [
        {
          "path": "docs/DESIGN.md",
          "line_start": 9,
          "line_end": 12,
          "note": "invariants"
        },
        {
          "path": "src/sum.js",
          "line_start": 8,
          "line_end": 9
        }
      ],
      "confidence": "high",
      "open_questions": [],
      "last_verified_commit": "a6558709a38078de799273851ae162d4d9a0599e",
      "source": "ewm:docs-scout",
      "stale": false,
      "recorded_at": "2026-10-09T23:30:28.451Z"
    },
    {
      "id": "F-004",
      "claim": "The test 'average of 2, 4, 6 is 4' expects 4 and the sum test expects sum([1,2,3,4]) to be 10; by reading, both fail against the current sum (10/3 and 9). Not run yet.",
      "evidence": [
        {
          "path": "test/average.test.js",
          "line_start": 10,
          "line_end": 12
        },
        {
          "path": "test/sum.test.js",
          "line_start": 6,
          "line_end": 8
        },
        {
          "path": "src/sum.js",
          "line_start": 8,
          "line_end": 9
        }
      ],
      "confidence": "medium",
      "open_questions": [
        "What does npm test actually report on the current commit?"
      ],
      "last_verified_commit": "a6558709a38078de799273851ae162d4d9a0599e",
      "source": "lead",
      "stale": false,
      "recorded_at": "2026-10-09T23:30:29.950Z"
    },
    {
      "id": "F-005",
      "claim": "The empty-list behaviour is consistent: DESIGN.md fixes average([]) at 0, the code guards for it, and a test asserts it.",
      "evidence": [
        {
          "path": "docs/DESIGN.md",
          "line_start": 6,
          "line_end": 6
        },
        {
          "path": "src/average.js",
          "line_start": 8,
          "line_end": 10
        },
        {
          "path": "test/average.test.js",
          "line_start": 6,
          "line_end": 8
        }
      ],
      "confidence": "high",
      "open_questions": [],
      "last_verified_commit": "a6558709a38078de799273851ae162d4d9a0599e",
      "source": "ewm:docs-scout",
      "stale": false,
      "recorded_at": "2026-10-09T23:30:31.184Z"
    },
    {
      "id": "F-006",
      "claim": "average.js is the only module importing sum, and the only in-repo caller of average is its test; format.js is independent (presentation only), so a fix in sum.js has a small blast radius.",
      "evidence": [
        {
          "path": "src/average.js",
          "line_start": 2,
          "line_end": 2
        },
        {
          "path": "test/average.test.js",
          "line_start": 4,
          "line_end": 4
        },
        {
          "path": "src/format.js",
          "line_start": 6,
          "line_end": 8
        }
      ],
      "confidence": "high",
      "open_questions": [],
      "last_verified_commit": "a6558709a38078de799273851ae162d4d9a0599e",
      "source": "ewm:repo-scout",
      "stale": false,
      "recorded_at": "2026-10-09T23:30:32.418Z"
    },
    {
      "id": "F-007",
      "claim": "npm test runs `node --test test/*.test.js`; the README documents it and it matches package.json.",
      "evidence": [
        {
          "path": "package.json",
          "line_start": 5,
          "line_end": 7
        },
        {
          "path": "README.md",
          "line_start": 11,
          "line_end": 13
        }
      ],
      "confidence": "high",
      "open_questions": [],
      "last_verified_commit": "a6558709a38078de799273851ae162d4d9a0599e",
      "source": "ewm:docs-scout",
      "stale": false,
      "recorded_at": "2026-10-09T23:30:33.288Z"
    }
  ],
  "open_questions": [
    {
      "id": "Q-001",
      "text": "Should the fix also add a regression test (for example, sum where the first element is non-zero), or is fixing the loop start in sum.js enough?",
      "status": "open",
      "raised_at": "2026-10-09T23:30:34.996Z"
    }
  ],
  "decisions": [
    {
      "id": "D-001",
      "title": "Scope: diagnosis plus fix",
      "choice": "Diagnose the root cause, then fix it after plan approval",
      "rationale": "Person stated: diagnosis plus a fix after plan approval",
      "phase": "INTAKE",
      "decided_by": "model",
      "at": "2026-10-09T23:29:52.069Z"
    }
  ],
  "approvals": [
    {
      "gate": "plan_approval",
      "decision": "approved",
      "by": "user",
      "via": "command",
      "at": "2026-10-09T23:33:28.267Z",
      "plan_hash": "20df3bc3"
    },
    {
      "gate": "done_acceptance",
      "decision": "approved",
      "by": "user",
      "via": "command",
      "at": "2026-10-09T23:33:55.026Z"
    }
  ],
  "transitions": [
    {
      "from": "INTAKE",
      "to": "EXPLORE",
      "actor": "model",
      "reason": "intake confirmed",
      "at": "2026-10-09T23:29:53.457Z"
    },
    {
      "from": "EXPLORE",
      "to": "UNDERSTAND",
      "actor": "model",
      "reason": "Seven sourced findings establish that sum() skips the first element, which makes average() wrong; the map is written.",
      "at": "2026-10-09T23:30:39.270Z"
    },
    {
      "from": "UNDERSTAND",
      "to": "PLAN",
      "actor": "model",
      "reason": "Person asked to proceed to the fix; the root cause (F-001) was explained and the affected area is small and fully mapped.",
      "at": "2026-10-09T23:31:26.581Z"
    },
    {
      "from": "PLAN",
      "to": "PAUSED",
      "actor": "user",
      "reason": "paused by the person",
      "at": "2026-10-09T23:31:46.549Z"
    },
    {
      "from": "PAUSED",
      "to": "PLAN",
      "actor": "user",
      "reason": "resumed",
      "at": "2026-10-09T23:31:55.803Z"
    },
    {
      "from": "PLAN",
      "to": "PAUSED",
      "actor": "user",
      "reason": "paused by the person",
      "at": "2026-10-09T23:32:21.533Z"
    },
    {
      "from": "PAUSED",
      "to": "PLAN",
      "actor": "user",
      "reason": "resumed",
      "at": "2026-10-09T23:32:24.084Z"
    },
    {
      "from": "PLAN",
      "to": "PAUSED",
      "actor": "user",
      "reason": "paused by the person",
      "at": "2026-10-09T23:33:01.799Z"
    },
    {
      "from": "PAUSED",
      "to": "PLAN",
      "actor": "user",
      "reason": "resumed",
      "at": "2026-10-09T23:33:04.262Z"
    },
    {
      "from": "PLAN",
      "to": "IMPLEMENT",
      "actor": "user",
      "reason": "plan_approval approved",
      "at": "2026-10-09T23:33:28.267Z"
    },
    {
      "from": "IMPLEMENT",
      "to": "VALIDATE",
      "actor": "model",
      "reason": "S-1 done; S-2 (npm test) is run in VALIDATE via run_validation",
      "at": "2026-10-09T23:33:36.723Z"
    },
    {
      "from": "VALIDATE",
      "to": "DONE",
      "actor": "user",
      "reason": "done_acceptance approved",
      "at": "2026-10-09T23:33:55.026Z"
    }
  ],
  "agent_usage": [
    {
      "agent_type": "ewm:repo-scout",
      "model": "claude-haiku-5-5",
      "phase": "EXPLORE",
      "rule": "profile.models.search",
      "at": "2026-10-09T23:29:55.744Z",
      "routed_model": "haiku",
      "agent_id": "a8bc4b2ecb98665b8",
      "description": "Repo scout: average()"
    },
    {
      "agent_type": "ewm:docs-scout",
      "model": "claude-haiku-5-5",
      "phase": "EXPLORE",
      "rule": "profile.models.search",
      "at": "2026-10-09T23:29:56.629Z",
      "routed_model": "haiku",
      "agent_id": "aa756e4b0671ccf42",
      "description": "Docs scout: average()"
    }
  ],
  "validations": [
    {
      "id": "V-001",
      "command": "npm test",
      "exit_code": 0,
      "ok": true,
      "duration_ms": 306,